{
  "environment": "polygon-fork",
  "chainId": 137,
  "reviewedAt": "2026-07-27T00:00:00Z",
  "registrySource": "https://docs.polymarket.com/resources/contracts",
  "manifestHash": "0x439995f214f884192307409f34c7abaf6765952641d7fa69171bfa4f578efd2d",
  "contracts": {
    "conditionalTokens": {
      "address": "0x4D97DCd97eC945f40cF65F87097ACe5EA0476045",
      "kind": "ERC1155"
    },
    "pUSD": {
      "address": "0xC011a7E12a19f7B1f670d46F03B03f3342E82DFB",
      "kind": "ERC20"
    },
    "pUSDImplementation": {
      "address": "0x6bBCef9f7ef3B6C592c99e0f206a0DE94Ad0925f",
      "kind": "implementation"
    },
    "usdce": {
      "address": "0x2791Bca1f2de4661ED88A30C99A7a9449Aa84174",
      "kind": "ERC20"
    },
    "ctfCollateralAdapter": {
      "address": "0xADa100874d00e3331D00F2007a9c336a65009718",
      "kind": "standard-adapter"
    },
    "negativeRiskCollateralAdapter": {
      "address": "0xAdA200001000ef00D07553cEE7006808F895c6F1",
      "kind": "negative-risk-adapter"
    },
    "negativeRiskAdapter": {
      "address": "0xd91E80cF2E7be2e162c6513ceD06f1dD0dA35296",
      "kind": "legacy-negative-risk-adapter"
    },
    "ctfExchange": {
      "address": "0xE111180000d2663C0091e4f400237545B87B996B",
      "kind": "exchange"
    },
    "negativeRiskCtfExchange": {
      "address": "0xe2222d279d744050d28e00520010520000310F59",
      "kind": "exchange"
    },
    "umaAdapter": {
      "address": "0x6A9D222616C90FcA5754cd1333cFD9b7fb6a4F74",
      "kind": "resolution-adapter"
    },
    "umaAdapterV3": {
      "address": "0x157Ce2d672854c848c9b79C49a8Cc6cc89176a49",
      "kind": "resolution-adapter",
      "notes": "Current adapter; v2 remains for existing markets."
    },
    "umaOptimisticOracle": {
      "address": "0xCB1822859cEF82Cd2Eb4E6276C7916e692995130",
      "kind": "oracle"
    },
    "positionManager": {
      "address": "0x006F54F7f9A22e0000CC2AB60031000000ae9fEF",
      "kind": "position-manager"
    },
    "binaryModule": {
      "address": "0x1000008dD9001B968442c1000017eaE6E0dA00Ba",
      "kind": "module"
    },
    "negativeRiskModule": {
      "address": "0x200000900045e3B6259600682756002200028933",
      "kind": "module"
    },
    "combinatorialModule": {
      "address": "0x30000034706C7d8e12009DAB006Be20000c031A8",
      "kind": "module"
    },
    "comboExchange": {
      "address": "0xe3333700cA9d93003F00f0F71f8515005F6c00Aa",
      "kind": "exchange"
    },
    "autoRedeemer": {
      "address": "0xa1200000d0002264C9a1698e001292D00E1b00af",
      "kind": "redeemer"
    }
  }
}
